{
  "$schema": "https://json-schema.org/draft/2020-12/schema",
  "$id": "https://resonateengine.dev/schema/resonate.host.schema.json",
  "title": "ResonateEngine host manifest",
  "description": "The capabilities the host itself provides, before any module is loaded. A module may require these; nothing may provide them again. scripts/module_check.lua holds the other half of that rule.",
  "type": "object",
  "required": ["id", "name", "abi", "summary", "provides"],
  "additionalProperties": false,
  "properties": {
    "id": {
      "description": "Identity of the host itself, unique among modules.",
      "type": "string",
      "pattern": "^resonate(\\.[a-z][a-z0-9_]*)+$"
    },
    "name": {
      "description": "Display name for logs and editor lists.",
      "type": "string",
      "minLength": 1
    },
    "abi": {
      "description": "Major ABI version the host implements.",
      "type": "integer",
      "minimum": 1
    },
    "summary": {
      "description": "One line describing the host's own capabilities.",
      "type": "string",
      "minLength": 1
    },
    "provides": {
      "description": "Capabilities the host publishes. Each must be declared by a capability header.",
      "type": "array",
      "minItems": 1,
      "items": {
        "description": "Capability name, as it appears in CapabilityTraits<T>::id.",
        "type": "string",
        "pattern": "^Resonate(\\.[A-Za-z][A-Za-z0-9]*)+$"
      },
      "uniqueItems": true
    }
  }
}
